{
  "url": "https://www.thetalentgroup.eu/production-designers/",
  "viewport": {
    "width": 1366,
    "height": 1024,
    "dpr": 3
  },
  "fps": 60,
  "trim": {
    "start": 4000
  },
  "page": {
    "cursor": { "auto": true }
  },
  "timeline": [
    {
      "at": "top",
      "hold": 0.8,
      "type": "start",
      "url": "https://www.thetalentgroup.eu/production-designers/"
    },
    {
      "samples": {
        "s": [
          0, 0, 0, 0, 0, 0, 0, 0, 0, 0, 0, 0, 0, 0, 0, 0, 0, 0, 0, 0, 0, 0, 0,
          0, 0, 0, 0, 0, 0, 0, 0, 0, 0, 0, 0, 0, 0, 0, 0, 0, 0, 0, 0, 0, 0, 0,
          0, 0, 0, 0, 0, 0, 0, 0, 0, 0, 0, 0, 0, 0, 0, 0, 0, 0, 0, 0, 0, 0, 0,
          0, 0, 0, 0, 0, 0, 0, 0, 0, 0, 0, 0, 0, 0, 0, 0, 0, 0, 0, 0, 0, 0, 0,
          0, 0, 0, 0, 0, 0, 0, 0, 0, 0, 0, 0, 0, 0, 0, 0, 0, 0, 0, 0, 0, 0, 0,
          0, 0, 0, 0, 0, 0, 0, 0, 0, 0, 0, 0, 0, 0, 0, 0, 0, 0, 0, 0, 0, 0, 0,
          0, 0, 0, 0, 0, 0, 0, 0, 0, 0, 0, 0, 0, 0, 0, 0, 0, 0, 0, 0, 0, 0, 0,
          0, 0, 0, 0, 0, 0, 0, 0, 0, 0, 0, 0, 0, 0, 0, 0, 0, 0, 0, 0, 0, 0, 0,
          0, 0, 0, 0, 0, 0, 0, 0, 0, 0, 0, 0, 0, 0, 0, 0, 0, 0, 0, 0, 0, 0, 0,
          0, 0, 0, 0, 0, 0, 0, 0, 0, 0, 0, 0, 0, 0, 0, 0, 0, 0, 0, 0, 0, 0, 0,
          0, 0, 0, 0, 0, 0, 0, 0, 0, 0, 0, 0, 0, 0, 0, 0, 0, 0, 0, 0, 0, 0, 0,
          0, 0, 0, 0, 0, 0, 0, 0, 0, 0, 0, 0, 0, 0, 0, 0, 0, 0, 0, 0, 0, 0, 0,
          0, 0, 0, 0, 0, 0, 0, 0, 0, 0, 0, 0, 0, 0, 0, 0, 0, 0, 0, 0, 0, 0, 0,
          0, 0, 0, 0, 0, 0, 0, 0, 0, 0, 0, 0, 0, 0, 0, 0, 0, 0, 0, 0, 0, 0, 0,
          0, 0, 0, 0, 0, 0, 0, 0, 0, 0, 0, 0, 0, 0, 0, 0, 0, 0, 0, 0, 0, 0, 0,
          0, 0, 0, 0, 0, 0, 0, 0, 0, 0, 0, 0, 0, 0, 0, 0, 0, 0, 0, 0, 0, 0, 0,
          0, 0, 0, 0, 0, 0, 0, 0, 0, 0, 0, 0, 0, 0, 0, 0, 0, 0, 0, 0, 0, 0, 0,
          0, 0, 0, 0, 0, 0, 0, 0, 0, 0, 0, 0, 0, 0, 0, 0, 0, 0, 0, 0, 0, 0, 0,
          0, 0, 0, 0, 0, 0, 0, 0, 0, 0, 0, 0, 0, 0, 0, 0, 0, 0, 0, 0, 0, 0, 0,
          0, 0, 0, 0, 0, 0, 0, 0, 0, 0, 0, 0, 0, 0, 0, 0, 0
        ],
        "t": [
          0, 17, 35, 49, 66, 83, 100, 116, 133, 149, 167, 183, 199, 216, 233,
          250, 266, 283, 299, 316, 333, 350, 367, 383, 400, 417, 433, 450, 466,
          483, 500, 516, 533, 551, 566, 583, 599, 616, 633, 649, 666, 683, 700,
          716, 733, 750, 767, 783, 800, 816, 833, 850, 866, 883, 900, 916, 933,
          950, 969, 983, 999, 1016, 1033, 1049, 1067, 1083, 1100, 1116, 1134,
          1150, 1166, 1184, 1200, 1216, 1233, 1250, 1266, 1284, 1299, 1319,
          1333, 1349, 1366, 1383, 1399, 1416, 1434, 1450, 1466, 1483, 1500,
          1516, 1533, 1550, 1566, 1583, 1600, 1616, 1633, 1650, 1666, 1684,
          1700, 1716, 1733, 1750, 1767, 1784, 1800, 1819, 1833, 1849, 1866,
          1883, 1899, 1916, 1933, 1950, 1967, 1984, 2000, 2016, 2033, 2050,
          2066, 2083, 2100, 2116, 2134, 2150, 2166, 2183, 2200, 2217, 2233,
          2249, 2266, 2283, 2301, 2316, 2333, 2349, 2366, 2383, 2399, 2416,
          2433, 2449, 2466, 2483, 2500, 2516, 2533, 2550, 2567, 2583, 2600,
          2616, 2633, 2650, 2667, 2684, 2700, 2717, 2737, 2750, 2766, 2783,
          2799, 2816, 2833, 2850, 2866, 2883, 2900, 2916, 2934, 2949, 2967,
          2983, 3000, 3017, 3033, 3050, 3066, 3084, 3100, 3120, 3136, 3150,
          3166, 3183, 3199, 3217, 3233, 3249, 3266, 3283, 3300, 3317, 3334,
          3349, 3366, 3383, 3400, 3417, 3434, 3450, 3467, 3483, 3501, 3516,
          3533, 3549, 3566, 3583, 3599, 3616, 3633, 3650, 3669, 3683, 3699,
          3716, 3733, 3749, 3766, 3783, 3800, 3816, 3833, 3850, 3866, 3883,
          3900, 3917, 3933, 3950, 3967, 3983, 4000, 4017, 4033, 4050, 4066,
          4083, 4100, 4117, 4133, 4150, 4166, 4184, 4200, 4219, 4233, 4250,
          4266, 4283, 4302, 4316, 4333, 4348, 4366, 4383, 4399, 4416, 4433,
          4450, 4466, 4484, 4500, 4516, 4533, 4550, 4566, 4583, 4599, 4616,
          4634, 4650, 4667, 4683, 4700, 4716, 4733, 4750, 4767, 4786, 4799,
          4816, 4833, 4849, 4866, 4883, 4899, 4916, 4933, 4950, 4966, 4983,
          5001, 5016, 5033, 5049, 5066, 5083, 5099, 5117, 5133, 5150, 5167,
          5183, 5200, 5216, 5233, 5250, 5267, 5283, 5300, 5316, 5334, 5353,
          5366, 5383, 5399, 5416, 5433, 5449, 5466, 5483, 5500, 5516, 5533,
          5552, 5566, 5583, 5600, 5616, 5633, 5650, 5667, 5683, 5700, 5716,
          5733, 5750, 5766, 5783, 5800, 5817, 5833, 5850, 5866, 5883, 5900,
          5916, 5933, 5952, 5966, 5983, 5999, 6016, 6033, 6049, 6066, 6083,
          6100, 6116, 6133, 6150, 6165, 6183, 6200, 6216, 6236, 6250, 6266,
          6283, 6299, 6316, 6333, 6350, 6366, 6383, 6400, 6416, 6433, 6450,
          6466, 6483, 6500, 6517, 6533, 6551, 6566, 6585, 6601, 6617, 6633,
          6652, 6666, 6683, 6699, 6716, 6733, 6749, 6767, 6783, 6799, 6816,
          6833, 6850, 6867, 6883, 6902, 6916, 6933, 6949, 6967, 6983, 6999,
          7016, 7033, 7050, 7066, 7083, 7099, 7116, 7132, 7150, 7166, 7183,
          7199, 7216, 7233, 7249, 7267, 7283, 7300, 7317, 7333, 7349, 7366,
          7383, 7400, 7415, 7433, 7450, 7465, 7483, 7499, 7516, 7533, 7550
        ],
        "x": [
          215, 214, 212, 210, 208, 207, 206, 206, 206, 205, 205, 205, 204, 203,
          202, 202, 201, 201, 199, 199, 198, 198, 198, 197, 197, 197, 197, 197,
          197, 197, 196, 196, 196, 196, 196, 195, 195, 195, 195, 194, 194, 193,
          194, 194, 194, 194, 194, 194, 193, 193, 193, 193, 192, 192, 191, 190,
          190, 189, 188, 188, 188, 187, 187, 187, 186, 186, 186, 185, 184, 183,
          182, 181, 180, 180, 179, 179, 178, 177, 176, 175, 175, 175, 174, 174,
          174, 173, 173, 173, 172, 172, 171, 171, 171, 171, 171, 171, 170, 170,
          170, 169, 169, 169, 169, 168, 168, 168, 168, 168, 168, 168, 168, 168,
          168, 168, 168, 168, 168, 168, 167, 167, 165, 166, 166, 166, 165, 165,
          165, 165, 165, 165, 165, 165, 165, 165, 164, 164, 164, 164, 164, 163,
          163, 163, 163, 163, 163, 163, 163, 162, 162, 162, 162, 161, 161, 161,
          161, 161, 161, 161, 161, 161, 161, 161, 161, 161, 161, 160, 160, 159,
          158, 158, 157, 157, 157, 157, 156, 156, 156, 156, 156, 156, 156, 156,
          156, 156, 157, 157, 157, 157, 157, 157, 157, 157, 157, 157, 157, 157,
          157, 157, 157, 156, 156, 156, 156, 156, 155, 155, 155, 155, 155, 154,
          154, 153, 153, 153, 153, 153, 152, 152, 152, 152, 152, 152, 151, 151,
          151, 150, 150, 150, 149, 149, 149, 149, 149, 149, 149, 148, 148, 148,
          148, 148, 148, 148, 148, 147, 147, 147, 147, 147, 147, 146, 146, 145,
          145, 145, 145, 145, 145, 145, 145, 145, 145, 144, 144, 143, 143, 143,
          143, 143, 143, 143, 143, 143, 143, 142, 142, 142, 142, 142, 142, 142,
          142, 142, 142, 141, 141, 142, 142, 143, 143, 143, 143, 143, 143, 144,
          145, 145, 145, 145, 146, 147, 148, 149, 150, 151, 153, 153, 154, 154,
          155, 156, 156, 157, 157, 157, 157, 157, 157, 157, 157, 157, 157, 156,
          156, 155, 155, 155, 155, 154, 154, 154, 154, 154, 154, 154, 154, 154,
          154, 154, 154, 154, 154, 153, 153, 153, 153, 153, 153, 153, 153, 153,
          153, 153, 153, 153, 153, 153, 152, 152, 152, 152, 152, 152, 151, 151,
          151, 151, 151, 151, 151, 151, 151, 151, 151, 151, 151, 151, 151, 151,
          151, 151, 151, 151, 151, 151, 151, 151, 151, 151, 151, 152, 152, 152,
          152, 152, 152, 153, 153, 153, 153, 153, 154, 154, 154, 154, 154, 154,
          154, 154, 154, 155, 155, 156, 156, 156, 156, 156, 156, 156, 156, 156,
          156, 156, 156, 156, 156, 156, 156, 156, 156, 156, 156, 156, 156, 156,
          156, 156, 156, 156, 156, 156, 156, 156, 156, 156, 156, 156, 156, 156,
          156, 156, 156, 156, 156, 156
        ],
        "y": [
          9, 18, 26, 33, 41, 46, 51, 54, 57, 59, 63, 66, 69, 74, 77, 79, 82, 85,
          90, 95, 97, 101, 104, 105, 106, 108, 109, 110, 110, 111, 112, 112,
          114, 115, 116, 118, 119, 121, 123, 125, 126, 128, 130, 131, 133, 134,
          136, 139, 140, 141, 144, 146, 148, 151, 155, 159, 162, 167, 169, 173,
          176, 177, 181, 183, 184, 186, 190, 192, 195, 198, 201, 205, 208, 211,
          213, 216, 221, 226, 229, 232, 235, 240, 242, 245, 247, 249, 252, 254,
          256, 258, 261, 263, 264, 266, 268, 270, 272, 274, 275, 277, 278, 281,
          283, 284, 286, 287, 290, 293, 295, 296, 297, 300, 301, 303, 304, 306,
          309, 312, 315, 320, 323, 326, 329, 330, 331, 332, 333, 334, 334, 335,
          335, 336, 338, 340, 344, 348, 355, 358, 362, 367, 370, 373, 376, 379,
          384, 387, 390, 393, 396, 400, 402, 404, 405, 406, 408, 410, 412, 415,
          416, 418, 419, 420, 421, 423, 425, 429, 432, 435, 442, 447, 450, 453,
          456, 459, 463, 465, 467, 469, 473, 474, 477, 478, 480, 481, 483, 484,
          485, 487, 490, 491, 493, 494, 496, 501, 504, 507, 510, 513, 514, 517,
          518, 519, 521, 522, 523, 524, 526, 527, 528, 529, 530, 532, 533, 535,
          537, 539, 540, 544, 546, 549, 552, 555, 561, 563, 565, 568, 570, 571,
          572, 573, 575, 576, 578, 579, 580, 581, 583, 584, 585, 586, 587, 588,
          588, 589, 590, 591, 592, 593, 594, 595, 597, 600, 601, 603, 605, 607,
          610, 613, 616, 619, 622, 624, 627, 629, 631, 634, 637, 639, 640, 642,
          644, 645, 647, 648, 649, 652, 654, 656, 657, 659, 661, 665, 666, 669,
          672, 675, 678, 681, 684, 689, 692, 695, 700, 707, 714, 717, 720, 725,
          733, 740, 746, 751, 756, 761, 768, 771, 774, 777, 780, 785, 788, 791,
          795, 798, 799, 800, 802, 803, 804, 805, 806, 808, 809, 810, 812, 814,
          816, 817, 821, 824, 827, 830, 833, 835, 836, 838, 839, 840, 841, 842,
          843, 844, 846, 847, 849, 850, 851, 852, 853, 854, 855, 857, 859, 860,
          863, 865, 868, 873, 876, 879, 882, 884, 889, 894, 899, 904, 907, 912,
          918, 921, 925, 929, 932, 935, 938, 941, 946, 949, 952, 955, 958, 963,
          966, 968, 971, 973, 976, 979, 982, 984, 986, 989, 991, 992, 994, 995,